[
  {
    "id": "b4a-001",
    "name": "Volbeat",
    "set_code": "b4a",
    "set_name": "Team Rocket's Ambition",
    "pack": "Team Rocket's Ambition",
    "release_date": "2026-08-27",
    "type": "Pokémon",
    "subtype": "Grass",
    "stage": "Basic",
    "evolves_from": null,
    "rarity": "◊",
    "pack_points": 35,
    "ex": false,
    "mega": false,
    "shiny": false,
    "special_tags": null,
    "art_style": null,
    "health": 80,
    "retreat": 1,
    "weakness": "Fire",
    "ability": {
      "exists": false,
      "name": null,
      "effect": null
    },
    "card_text": null,
    "attacks": {
      "1": {
        "cost": "G",
        "name": "Tackle",
        "damage": 30,
        "effect": null
      },
      "2": {
        "cost": null,
        "name": null,
        "damage": null,
        "effect": null
      }
    },
    "points": 1,
    "tradable": true,
    "sharable": true,
    "trade_cost": 0,
    "deckBuilderNr": 2119,
    "artist": "Kanako Eo",
    "image": "https://raw.githubusercontent.com/chase-manning/pokemon-tcg-pocket-cards/refs/heads/main/images/webp/cards/b4a/001.webp",
    "image_png": "https://raw.githubusercontent.com/chase-manning/pokemon-tcg-pocket-cards/refs/heads/main/images/png/cards/b4a/001.png",
    "flavour_text": "It flashes the light on its rear to communicate with other Volbeat. It loves the sweet aroma given off by Illumise.",
    "alternate_versions": []
  },
  {
    "id": "b4a-002",
    "name": "Illumise",
    "set_code": "b4a",
    "set_name": "Team Rocket's Ambition",
    "pack": "Team Rocket's Ambition",
    "release_date": "2026-08-27",
    "type": "Pokémon",
    "subtype": "Grass",
    "stage": "Basic",
    "evolves_from": null,
    "rarity": "◊",
    "pack_points": 35,
    "ex": false,
    "mega": false,
    "shiny": false,
    "special_tags": null,
    "art_style": null,
    "health": 70,
    "retreat": 1,
    "weakness": "Fire",
    "ability": {
      "exists": false,
      "name": null,
      "effect": null
    },
    "card_text": null,
    "attacks": {
      "1": {
        "cost": "GC",
        "name": "Ire-Fly",
        "damage": 30,
        "effect": "If Volbeat is in your discard pile, this attack does 60 more damage."
      },
      "2": {
        "cost": null,
        "name": null,
        "damage": null,
        "effect": null
      }
    },
    "points": 1,
    "tradable": true,
    "sharable": true,
    "trade_cost": 0,
    "deckBuilderNr": 2120,
    "artist": "Kanako Eo",
    "image": "https://raw.githubusercontent.com/chase-manning/pokemon-tcg-pocket-cards/refs/heads/main/images/webp/cards/b4a/002.webp",
    "image_png": "https://raw.githubusercontent.com/chase-manning/pokemon-tcg-pocket-cards/refs/heads/main/images/png/cards/b4a/002.png",
    "flavour_text": "It guides Volbeat to draw signs in the night sky. There are scholars who research the meaning of these signs.",
    "alternate_versions": []
  },
  {
    "id": "b4a-003",
    "name": "Snivy",
    "set_code": "b4a",
    "set_name": "Team Rocket's Ambition",
    "pack": "Team Rocket's Ambition",
    "release_date": "2026-08-27",
    "type": "Pokémon",
    "subtype": "Grass",
    "stage": "Basic",
    "evolves_from": null,
    "rarity": "◊",
    "pack_points": 35,
    "ex": false,
    "mega": false,
    "shiny": false,
    "special_tags": null,
    "art_style": null,
    "health": 60,
    "retreat": 1,
    "weakness": "Fire",
    "ability": {
      "exists": false,
      "name": null,
      "effect": null
    },
    "card_text": null,
    "attacks": {
      "1": {
        "cost": "G",
        "name": "Leaf Boomerang",
        "damage": 20,
        "effect": "Flip 2 coins. This attack does 20 damage for each heads."
      },
      "2": {
        "cost": null,
        "name": null,
        "damage": null,
        "effect": null
      }
    },
    "points": 1,
    "tradable": true,
    "sharable": true,
    "trade_cost": 0,
    "deckBuilderNr": 2121,
    "artist": "Atsuko Nishida",
    "image": "https://raw.githubusercontent.com/chase-manning/pokemon-tcg-pocket-cards/refs/heads/main/images/webp/cards/b4a/003.webp",
    "image_png": "https://raw.githubusercontent.com/chase-manning/pokemon-tcg-pocket-cards/refs/heads/main/images/png/cards/b4a/003.png",
    "flavour_text": "It prefers to avoid groups. In its day-to-day life, it dexterously controls its vines to compensate for its short arms.",
    "alternate_versions": []
  },
  {
    "id": "b4a-004",
    "name": "Servine",
    "set_code": "b4a",
    "set_name": "Team Rocket's Ambition",
    "pack": "Team Rocket's Ambition",
    "release_date": "2026-08-27",
    "type": "Pokémon",
    "subtype": "Grass",
    "stage": "Stage 1",
    "evolves_from": "Snivy",
    "rarity": "◊◊",
    "pack_points": 70,
    "ex": false,
    "mega": false,
    "shiny": false,
    "special_tags": null,
    "art_style": null,
    "health": 80,
    "retreat": 1,
    "weakness": "Fire",
    "ability": {
      "exists": false,
      "name": null,
      "effect": null
    },
    "card_text": null,
    "attacks": {
      "1": {
        "cost": "G",
        "name": "Leaf Step",
        "damage": 30,
        "effect": null
      },
      "2": {
        "cost": null,
        "name": null,
        "damage": null,
        "effect": null
      }
    },
    "points": 1,
    "tradable": true,
    "sharable": true,
    "trade_cost": 0,
    "deckBuilderNr": 2122,
    "artist": "Kagemaru Himeno",
    "image": "https://raw.githubusercontent.com/chase-manning/pokemon-tcg-pocket-cards/refs/heads/main/images/webp/cards/b4a/004.webp",
    "image_png": "https://raw.githubusercontent.com/chase-manning/pokemon-tcg-pocket-cards/refs/heads/main/images/png/cards/b4a/004.png",
    "flavour_text": "Servine’s one weakness is its inflated sense of pride. It takes a while for Servine to be able to cooperate with other Pokémon.",
    "alternate_versions": []
  },
  {
    "id": "b4a-005",
    "name": "Serperior",
    "set_code": "b4a",
    "set_name": "Team Rocket's Ambition",
    "pack": "Team Rocket's Ambition",
    "release_date": "2026-08-27",
    "type": "Pokémon",
    "subtype": "Grass",
    "stage": "Stage 2",
    "evolves_from": "Servine",
    "rarity": "◊◊◊",
    "pack_points": 150,
    "ex": false,
    "mega": false,
    "shiny": false,
    "special_tags": null,
    "art_style": null,
    "health": 100,
    "retreat": 2,
    "weakness": "Fire",
    "ability": {
      "exists": true,
      "name": "Regal Bloom",
      "effect": "This Pokémon gets +30 HP for each [G] Energy attached to it."
    },
    "card_text": null,
    "attacks": {
      "1": {
        "cost": "CCC",
        "name": "Flog",
        "damage": 60,
        "effect": "Flip a coin. If heads, this attack does 60 more damage."
      },
      "2": {
        "cost": null,
        "name": null,
        "damage": null,
        "effect": null
      }
    },
    "points": 1,
    "tradable": true,
    "sharable": true,
    "trade_cost": 1200,
    "deckBuilderNr": 2123,
    "artist": "Mizue",
    "image": "https://raw.githubusercontent.com/chase-manning/pokemon-tcg-pocket-cards/refs/heads/main/images/webp/cards/b4a/005.webp",
    "image_png": "https://raw.githubusercontent.com/chase-manning/pokemon-tcg-pocket-cards/refs/heads/main/images/png/cards/b4a/005.png",
    "flavour_text": "An intimidating gaze and majestic appearance have caused this Pokémon to be known as the Lord of the Forest.",
    "alternate_versions": []
  },
  {
    "id": "b4a-006",
    "name": "Team Rocket's Magmar",
    "set_code": "b4a",
    "set_name": "Team Rocket's Ambition",
    "pack": "Team Rocket's Ambition",
    "release_date": "2026-08-27",
    "type": "Pokémon",
    "subtype": "Fire",
    "stage": "Basic",
    "evolves_from": null,
    "rarity": "◊",
    "pack_points": 35,
    "ex": false,
    "mega": false,
    "shiny": false,
    "special_tags": null,
    "art_style": null,
    "health": 70,
    "retreat": 2,
    "weakness": "Water",
    "ability": {
      "exists": false,
      "name": null,
      "effect": null
    },
    "card_text": null,
    "attacks": {
      "1": {
        "cost": "C",
        "name": "Derisive Roasting",
        "damage": 10,
        "effect": "This attack does 50 more damage for each Special Condition affecting your opponent's Active Pokémon."
      },
      "2": {
        "cost": null,
        "name": null,
        "damage": null,
        "effect": null
      }
    },
    "points": 1,
    "tradable": true,
    "sharable": true,
    "trade_cost": 0,
    "deckBuilderNr": 2124,
    "artist": "matazo",
    "image": "https://raw.githubusercontent.com/chase-manning/pokemon-tcg-pocket-cards/refs/heads/main/images/webp/cards/b4a/006.webp",
    "image_png": "https://raw.githubusercontent.com/chase-manning/pokemon-tcg-pocket-cards/refs/heads/main/images/png/cards/b4a/006.png",
    "flavour_text": "Wavering flames similar to those of the sun appear on the surface of this Pokémon’s body.",
    "alternate_versions": []
  },
  {
    "id": "b4a-007",
    "name": "Team Rocket's Moltres ex",
    "set_code": "b4a",
    "set_name": "Team Rocket's Ambition",
    "pack": "Team Rocket's Ambition",
    "release_date": "2026-08-27",
    "type": "Pokémon",
    "subtype": "Fire",
    "stage": "Basic",
    "evolves_from": null,
    "rarity": "◊◊◊◊",
    "pack_points": 500,
    "ex": true,
    "mega": false,
    "shiny": false,
    "special_tags": null,
    "art_style": null,
    "health": 130,
    "retreat": 2,
    "weakness": "Water",
    "ability": {
      "exists": false,
      "name": null,
      "effect": null
    },
    "card_text": null,
    "attacks": {
      "1": {
        "cost": "R",
        "name": "Heat Charged",
        "damage": null,
        "effect": "Flip 3 coins. For each heads, produce a [R] Energy from your Energy Zone and attach it to this Pokémon."
      },
      "2": {
        "cost": "RRRC",
        "name": "Netherwing",
        "damage": 130,
        "effect": "Discard a [R] Energy from this Pokémon."
      }
    },